{"ok":true,"verdict":"risk","engineOutcome":"risk","reason":"issuer_control_finding_present","findingCodes":["issuer_control.freeze_authority_active","token2022.metadata_pointer_present","token2022.token_metadata_present","venue.infrastructure_tier_mutable_but_known"],"triggeringFindingCodes":["issuer_control.freeze_authority_active"],"findings":[{"code":"issuer_control.freeze_authority_active","source":"mint_account_evidence","subject":"freeze_authority","evidence":{"optionTag":1,"present":true,"address":"JE3sgcY4Ua7Ud7hCgpuNzYxXuQNVHofp6RYPK41DgbdS"}},{"code":"token2022.metadata_pointer_present","source":"mint_account_evidence","subject":"metadata_pointer","evidence":{"extensionPresent":true,"authority":"JE3sgcY4Ua7Ud7hCgpuNzYxXuQNVHofp6RYPK41DgbdS","metadataAddress":"qEJQAbaUbAiZ1gbz22TPtc6xhKmRYQA1HXWDCdfKump","pointsToSelf":null,"rawValueLength":64}},{"code":"token2022.token_metadata_present","source":"mint_account_evidence","subject":"token_metadata","evidence":{"extensionPresent":true,"rawValueLength":168}},{"code":"venue.infrastructure_tier_mutable_but_known","source":"token_program_dependency_evidence","subject":"token_program_dependency","evidence":{"tokenProgramAddress":"TokenzQdBNbLqP5VEhdkAS6EPFLC1PHnBqCXEpPxuEb","dependencyKind":"known_policy_program","programFamilyName":"Token-2022 Program","classification":"mutable_but_known_infrastructure","phase0IdentityStatus":"verified_present","phase0MutabilityStatus":"upgradeable","upgradeAuthority":"AeLmXCbPaQHGWRLr2saFsEVfmMNuKnxRAbWCT9P5twgz"}}],"coverageGaps":["liquidity","top_holders","deployer_outcomes"],"replayable":true,"rpc":{"commitment":"finalized","mintAddress":"qEJQAbaUbAiZ1gbz22TPtc6xhKmRYQA1HXWDCdfKump","metadataAddress":null,"observedSlot":424327686},"engineVersion":"raven-solana-live-scan@0.1.0","raven_version":"raven-acp-0.1.0","replayHash":"sha256:844a1f7930e3fae71127ae52ef748c98bb343abb86c24d365aecfd7d899f6739","officialAttestationHash":"sha256:d0b48ee95375108b94ace9a3d66e51d6c73e976263e04c5663a145997726d6be","keyId":"rvk_c2997e90215279c2","issuedAt":"2026-06-04T21:46:55.189Z","signature":"QIDqP3FmUGqv0Pg3YUXRSVN9mG/hEArqZv1Yn/UE0WyGFN3J3TfrQX1iiY/Svvo96qDCU+sMIG6EuAvLJBGaDw==","attestationPublicKey":"MCowBQYDK2VwAyEASGJt4Ilx2Z6g0BVC1VQIfaUcV0nr8WB1J45/8vfje6w=","signatureAlg":"ed25519","served_at":"2026-06-04T21:46:55.189Z"}